date,full_text,lower,cleaned,normalized,stopword,steemed,tokens,text_en,vader_compound,vader_label
2023-01-04,$ISAT Rekomendasi : Buy Time Horizon 1 - 5 hari Menuntaskan transaksi inbreng senilai Rp205 7 miliar melibatkan Aplikasinusa Lintasarta Starone Mitra Telekomunikasi (SMT) dan BDX Asia Data Center Holdings Pte Ltd. Transaksi itu telah diteken pada 23 Desember 2022.,$isat rekomendasi : buy time horizon 1 - 5 hari menuntaskan transaksi inbreng senilai rp205 7 miliar melibatkan aplikasinusa lintasarta starone mitra telekomunikasi (smt) dan bdx asia data center holdings pte ltd. transaksi itu telah diteken pada 23 desember 2022.,isat rekomendasi buy time horizon 1 5 hari menuntaskan transaksi inbreng senilai rp205 7 miliar melibatkan aplikasinusa lintasarta starone mitra telekomunikasi smt dan bdx asia data center holdings pte ltd transaksi itu telah diteken pada 23 desember 2022,isat rekomendasi buy time horizon 1 5 hari menuntaskan transaksi inbreng senilai rp205 7 miliar melibatkan aplikasinusa lintasarta starone mitra telekomunikasi smt dan bdx asia data center holdings pte ltd transaksi itu telah diteken pada 23 desember 2022,isat rekomendasi buy time horizon 1 5 hari menuntaskan transaksi inbreng senilai rp205 7 miliar melibatkan aplikasinusa lintasarta starone mitra telekomunikasi smt bdx asia data center holdings pte ltd transaksi telah diteken 23 desember 2022,isat rekomendasi buy time horizon 1 5 hari tuntas transaksi inbreng nila rp205 7 miliar libat aplikasinusa lintasarta starone mitra telekomunikasi smt bdx asia data center holdings pte ltd transaksi telah teken 23 desember 2022,"['isat', 'rekomendasi', 'buy', 'time', 'horizon', '1', '5', 'hari', 'tuntas', 'transaksi', 'inbreng', 'nila', 'rp205', '7', 'miliar', 'libat', 'aplikasinusa', 'lintasarta', 'starone', 'mitra', 'telekomunikasi', 'smt', 'bdx', 'asia', 'data', 'center', 'holdings', 'pte', 'ltd', 'transaksi', 'telah', 'teken', '23', 'desember', '2022']","['Isat', 'Recommendation', 'Buy', 'Time', 'Horizon', '1', '5', '5', 'Day', 'Complete', 'Transactions',' Inbreng ',' Nila ',' Rp 'BDX', 'Asia', 'Data', 'Center', 'Holdings', 'PTE', 'Ltd', 'Ltd', 'Transaction', 'Transactions', 'Has', 'Tighten', '23', 'December', '2022']",0.296,2
2023-01-04,$ISAT Harga ditutup di atas EMA5 10 dan membentuk pola long white marubozu yang merupakan sinyal bullish continuation stochastic konsisten overbought dan MACD histogram divergence positif. Current Price : 6.300 Take Profit 1 : 6.400 Take Profit 2 : 6.500 Cut Loss : &lt; 6.100,$isat harga ditutup di atas ema5 10 dan membentuk pola long white marubozu yang merupakan sinyal bullish continuation stochastic konsisten overbought dan macd histogram divergence positif. current price : 6.300 take profit 1 : 6.400 take profit 2 : 6.500 cut loss : &lt; 6.100,isat harga ditutup di atas ema5 10 dan membentuk pola long white marubozu yang merupakan sinyal bullish continuation stochastic konsisten overbought dan macd histogram divergence positif current price 6300 take profit 1 6400 take profit 2 6500 cut loss lt 6100,isat harga ditutup di atas ema5 10 dan membentuk pola long white marubozu yang merupakan sinyal bullish kelanjutan tren indikator teknikal konsisten overbought dan macd histogram penyimpangan tren positif current price 6300 take profit 1 6400 take profit 2 6500 cut loss lt 6100,isat harga ditutup atas ema5 10 membentuk pola long white marubozu merupakan sinyal bullish kelanjutan tren indikator teknikal konsisten overbought macd histogram penyimpangan tren positif current price 6300 take profit 1 6400 take profit 2 6500 cut loss lt 6100,isat harga tutup atas ema5 10 bentuk pola long white marubozu rupa sinyal bullish lanjut tren indikator teknikal konsisten overbought macd histogram simpang tren positif current price 6300 take profit 1 6400 take profit 2 6500 cut loss lt 6100,"['isat', 'harga', 'tutup', 'atas', 'ema5', '10', 'bentuk', 'pola', 'long', 'white', 'marubozu', 'rupa', 'sinyal', 'bullish', 'lanjut', 'tren', 'indikator', 'teknikal', 'konsisten', 'overbought', 'macd', 'histogram', 'simpang', 'tren', 'positif', 'current', 'price', '6300', 'take', 'profit', '1', '6400', 'take', 'profit', '2', '6500', 'cut', 'loss', 'lt', '6100']","['Isat', 'price', 'closed', 'above', 'ema5', '10', 'form', 'pattern', 'long', 'white', 'marubozu', 'form', 'signal', 'bullish', 'continued', 'trend', 'indicator', 'technical', 'consistent' 'Trends', 'positive', 'current', 'price', '6300', 'take', 'profit', 'profit', '1', '6400', 'Take', 'Profit', '2', '6500', '6500', 'Cut', 'Loss', 'Lt', '6100'",0.9042,2
2023-01-11,$ISAT Rekomendasi : Buy Time Horizon 1 - 5 hari Jumlah pelanggan ISAT kini sudah tembus 100 juta orang. Per akhir kuarta 3 2022 pelanggan ISAT berada pada kisaran 98 6 juta. Artinya dalam kurun 2 bulan terakhir perusahaan telah menggaet sekitar 1-2 juta pelanggan.,$isat rekomendasi : buy time horizon 1 - 5 hari jumlah pelanggan isat kini sudah tembus 100 juta orang. per akhir kuarta 3 2022 pelanggan isat berada pada kisaran 98 6 juta. artinya dalam kurun 2 bulan terakhir perusahaan telah menggaet sekitar 1-2 juta pelanggan.,isat rekomendasi buy time horizon 1 5 hari jumlah pelanggan isat kini sudah tembus 100 juta orang per akhir kuarta 3 2022 pelanggan isat berada pada kisaran 98 6 juta artinya dalam kurun 2 bulan terakhir perusahaan telah menggaet sekitar 12 juta pelanggan,isat rekomendasi buy time horizon 1 5 hari jumlah pelanggan isat kini sudah tembus 100 juta orang per akhir kuarta 3 2022 pelanggan isat berada pada kisaran 98 6 juta artinya dalam kurun 2 bulan terakhir perusahaan telah menggaet sekitar 12 juta pelanggan,isat rekomendasi buy time horizon 1 5 hari jumlah pelanggan isat kini tembus 100 juta orang per akhir kuarta 3 2022 pelanggan isat berada kisaran 98 6 juta artinya kurun 2 bulan terakhir perusahaan menggaet 12 juta pelanggan,isat rekomendasi buy time horizon 1 5 hari jumlah langgan isat kini tembus 100 juta orang per akhir arta 3 2022 langgan isat ada kisar 98 6 juta arti kurun 2 bulan akhir usaha gaet 12 juta langgan,"['isat', 'rekomendasi', 'buy', 'time', 'horizon', '1', '5', 'hari', 'jumlah', 'langgan', 'isat', 'kini', 'tembus', '100', 'juta', 'orang', 'per', 'akhir', 'arta', '3', '2022', 'langgan', 'isat', 'ada', 'kisar', '98', '6', 'juta', 'arti', 'kurun', '2', 'bulan', 'akhir', 'usaha', 'gaet', '12', 'juta', 'langgan']","['Isat', 'Recommendation', 'Buy', 'Time', 'Horizon', '1', '5', '5', 'Day', 'Number', 'Langs', 'Isat', 'Isat', 'Now', 'Translucent', '100', 'Million', 'People', 'Per', 'End', 'Arta', '3', '2022', 'Langsan', 'Isat', 'Isat', 'Isat' 'Kisar', '98', '6', 'Million', 'Meaning', 'Kurun', '2', 'Month', 'End', 'Effort', 'Gaet', '12', 'Million', 'Langsing']",0.3612,2
2023-01-11,$ISAT Harga ditutup di atas EMA5 10 dan membentuk pola white opening marubozu yang merupakan sinyal bullish continuation stochastic netral dan MACD histogram convergence positif. Current Price : 6.100 Take Profit 1 : 6.200 Take Profit 2 : 6.300 Cut Loss : &lt; 5.900,$isat harga ditutup di atas ema5 10 dan membentuk pola white opening marubozu yang merupakan sinyal bullish continuation stochastic netral dan macd histogram convergence positif. current price : 6.100 take profit 1 : 6.200 take profit 2 : 6.300 cut loss : &lt; 5.900,isat harga ditutup di atas ema5 10 dan membentuk pola white opening marubozu yang merupakan sinyal bullish continuation stochastic netral dan macd histogram convergence positif current price 6100 take profit 1 6200 take profit 2 6300 cut loss lt 5900,isat harga ditutup di atas ema5 10 dan membentuk pola white opening marubozu yang merupakan sinyal bullish kelanjutan tren indikator teknikal netral dan macd histogram convergence positif current price 6100 take profit 1 6200 take profit 2 6300 cut loss lt 5900,isat harga ditutup atas ema5 10 membentuk pola white opening marubozu merupakan sinyal bullish kelanjutan tren indikator teknikal netral macd histogram convergence positif current price 6100 take profit 1 6200 take profit 2 6300 cut loss lt 5900,isat harga tutup atas ema5 10 bentuk pola white opening marubozu rupa sinyal bullish lanjut tren indikator teknikal netral macd histogram convergence positif current price 6100 take profit 1 6200 take profit 2 6300 cut loss lt 5900,"['isat', 'harga', 'tutup', 'atas', 'ema5', '10', 'bentuk', 'pola', 'white', 'opening', 'marubozu', 'rupa', 'sinyal', 'bullish', 'lanjut', 'tren', 'indikator', 'teknikal', 'netral', 'macd', 'histogram', 'convergence', 'positif', 'current', 'price', '6100', 'take', 'profit', '1', '6200', 'take', 'profit', '2', '6300', 'cut', 'loss', 'lt', '5900']","['Isat', 'Price', 'Closed', 'Up', 'Ema5', '10', 'Form', 'Pattern', 'White', 'Opening', 'Marubozu', 'Look', 'Signal', 'Bullish', 'Continue', 'Continue', 'Trend', 'Indicator', 'Technical', 'Technical', 'Neutral', 'Histogram', 'Histogram', 'Convence', 'CONVVERCE' 'Current', 'Price', '6100', 'Take', 'Profit', '1', '6200', 'Take', 'Profit', '2', '6300', 'Cut', 'Loss', 'Lt', '5900']",0.6908,2
2023-02-13,$ISAT Break resist. https://t.co/8vivTtfx5s,$isat break resist. https://t.co/8vivttfx5s,isat break resist,isat break resist,isat break resist,isat break resist,"['isat', 'break', 'resist']","['isat', 'break', 'resist']",-0.2023,1
2023-02-14,Indosat Ooredoo Hutchison Tbk $ISAT mengalokasikan belanja modal senilai Rp 13 triliun pada 2023. Secara optimis menargetkan pertumbuhan pelanggan baru di tahun 2023 melebihi pertumbuhan industri 5-6 persen. Saat ini pelanggan IOH telah mencapai 106 juta. #bebipinter #indosat,indosat ooredoo hutchison tbk $isat mengalokasikan belanja modal senilai rp 13 triliun pada 2023. secara optimis menargetkan pertumbuhan pelanggan baru di tahun 2023 melebihi pertumbuhan industri 5-6 persen. saat ini pelanggan ioh telah mencapai 106 juta. #bebipinter #indosat,indosat ooredoo hutchison tbk isat mengalokasikan belanja modal senilai rp 13 triliun pada 2023 secara optimis menargetkan pertumbuhan pelanggan baru di tahun 2023 melebihi pertumbuhan industri 56 persen saat ini pelanggan ioh telah mencapai 106 juta bebipinter indosat,indosat ooredoo hutchison tbk isat mengalokasikan belanja modal senilai rp 13 triliun pada 2023 secara optimis menargetkan pertumbuhan pelanggan baru di tahun 2023 melebihi pertumbuhan industri 56 persen saat ini pelanggan ioh telah mencapai 106 juta bebipinter indosat,indosat ooredoo hutchison tbk isat mengalokasikan belanja modal senilai rp 13 triliun 2023 optimis menargetkan pertumbuhan pelanggan baru tahun 2023 melebihi pertumbuhan industri 56 persen ini pelanggan ioh mencapai 106 juta bebipinter indosat,indosat ooredoo hutchison tbk isat alokasi belanja modal nila rp 13 triliun 2023 optimis target tumbuh langgan baru tahun 2023 lebih tumbuh industri 56 persen ini langgan ioh capai 106 juta bebipinter indosat,"['indosat', 'ooredoo', 'hutchison', 'tbk', 'isat', 'alokasi', 'belanja', 'modal', 'nila', 'rp', '13', 'triliun', '2023', 'optimis', 'target', 'tumbuh', 'langgan', 'baru', 'tahun', '2023', 'lebih', 'tumbuh', 'industri', '56', 'persen', 'ini', 'langgan', 'ioh', 'capai', '106', 'juta', 'bebipinter', 'indosat']","['Indosat', 'Ooredoo', 'Hutchison', 'Tbk', 'Isat', 'Allocation', 'Expenditure', 'Capital', 'Capital', 'Tilapia', 'RP', '13', 'Trillion', 'Trillion', '2023', 'Optimistic', 'Target', 'Grow', 'Growing', 'Langs',' New ',' New ',' New ',' 2023 ',' 2023 ',' 2023 ',' '56', 'percent', 'this', 'Langgan', 'IOH', 'Tired', '106', 'Million', 'Bebipinter', 'Indosat']",0.6369,2
2023-02-16,PT Indosat Tbk $ISAT atau Indosat Ooredoo Hutchison akan menjual 997 lokasi menara kepada PT Dayamitra Telekomunikasi Tbk $MTEL alias Mitratel senilai Rp 1 64 triliun. . . . #bebipinter #indosat #menara,pt indosat tbk $isat atau indosat ooredoo hutchison akan menjual 997 lokasi menara kepada pt dayamitra telekomunikasi tbk $mtel alias mitratel senilai rp 1 64 triliun. . . . #bebipinter #indosat #menara,pt indosat tbk isat atau indosat ooredoo hutchison akan menjual 997 lokasi menara kepada pt dayamitra telekomunikasi tbk mtel alias mitratel senilai rp 1 64 triliun bebipinter indosat menara,pt indosat tbk isat atau indosat ooredoo hutchison akan menjual 997 lokasi menara kepada pt dayamitra telekomunikasi tbk mtel alias mitratel senilai rp 1 64 triliun bebipinter indosat menara,pt indosat tbk isat indosat ooredoo hutchison menjual 997 lokasi menara pt dayamitra telekomunikasi tbk mtel alias mitratel senilai rp 1 64 triliun bebipinter indosat menara,pt indosat tbk isat indosat ooredoo hutchison jual 997 lokasi menara pt dayamitra telekomunikasi tbk mtel alias mitratel nila rp 1 64 triliun bebipinter indosat menara,"['pt', 'indosat', 'tbk', 'isat', 'indosat', 'ooredoo', 'hutchison', 'jual', '997', 'lokasi', 'menara', 'pt', 'dayamitra', 'telekomunikasi', 'tbk', 'mtel', 'alias', 'mitratel', 'nila', 'rp', '1', '64', 'triliun', 'bebipinter', 'indosat', 'menara']","['PT', 'Indosat', 'Tbk', 'Isat', 'Indosat', 'Ooredoo', 'Hutchison', 'Sell', '997', 'Location', 'Menara', 'Menara', 'PT', 'Dayamitra', 'Telecommunications', 'Tbk', 'Tbk' '64', 'trillion', 'bebipinter', 'indosat', 'tower']",-0.1779,1
2023-02-18,sepekan kemarin ada 1 he dengane fund yang shifting Portofolio'nya... Lepas saham $MEDC dan $BRIS untuk beralih belanja $MDKA dan $ISAT serta cicil $CPIN *akumulasi perlahan?,sepekan kemarin ada 1 he dengane fund yang shifting portofolio'nya... lepas saham $medc dan $bris untuk beralih belanja $mdka dan $isat serta cicil $cpin *akumulasi perlahan?,sepekan kemarin ada 1 he dengane fund yang shifting portofolionya lepas saham medc dan bris untuk beralih belanja mdka dan isat serta cicil cpin akumulasi perlahan,sepekan kemarin ada 1 he dengane fund yang shifting portofolionya lepas saham medc dan bris untuk beralih belanja mdka dan isat serta cicil cpin akumulasi perlahan,sepekan kemarin 1 he dengane fund shifting portofolionya lepas saham medc bris beralih belanja mdka isat cicil cpin akumulasi perlahan,pek kemarin 1 he dengane fund shifting portofolio lepas saham medc bris alih belanja mdka isat cicil cpin akumulasi perlahan,"['pek', 'kemarin', '1', 'he dengane', 'fund', 'shifting', 'portofolio', 'lepas', 'saham', 'medc', 'bris', 'alih', 'belanja', 'mdka', 'isat', 'cicil', 'cpin', 'akumulasi', 'perlahan']","['Pek', 'yesterday', '1', 'He with', 'Fund', 'Shifting', 'Portfolio', 'Remove', 'Stock', 'Medc', 'Bris',' TWL ',' Shopping ',' Shopping ',' MDKA ',' Isat ',' Cicil ',' Cicil ',' Cicil ','",0.0,0
2023-02-20,$ISAT naik 4% ASLC naik 5%. Dua saham yang jadi menu trading kita di list hari Jumat lalu. Alhamdulillah syariah dua-duanya. Berkah hari Jumat masih dirasakan hari ini. https://t.co/uOeZYxnPA5,$isat naik 4% aslc naik 5%. dua saham yang jadi menu trading kita di list hari jumat lalu. alhamdulillah syariah dua-duanya. berkah hari jumat masih dirasakan hari ini. https://t.co/uoezyxnpa5,isat naik 4 aslc naik 5 dua saham yang jadi menu trading kita di list hari jumat lalu alhamdulillah syariah duaduanya berkah hari jumat masih dirasakan hari ini,isat naik 4 aslc naik 5 dua saham yang jadi menu trading kita di list hari jumat lalu alhamdulillah syariah duaduanya berkah hari jumat masih dirasakan hari ini,isat naik 4 aslc naik 5 saham jadi menu trading di list hari jumat lalu alhamdulillah syariah duaduanya berkah hari jumat dirasakan hari,isat naik 4 aslc naik 5 saham jadi menu trading di list hari jumat lalu alhamdulillah syariah duaduanya berkah hari jumat rasa hari,"['isat', 'naik', '4', 'aslc', 'naik', '5', 'saham', 'jadi', 'menu', 'trading', 'di', 'list', 'hari', 'jumat', 'lalu', 'alhamdulillah', 'syariah', 'duanya', 'berkah', 'hari', 'jumat', 'rasa', 'hari']","['Isat', 'Ride', '4', 'Aslc', 'Rise', '5', 'Stock', 'So', 'Menu', 'Trading', 'Di', 'List', 'Day', 'Friday', 'then', 'Alhamdulillah', 'Sharia', 'Both', 'Blessing', 'Blessing', 'Blessing', 'Blessing', 'Blessing', 'Blessing', 'Blessing', 'Blessing', 'Blessing', '",0.9686,2
2023-02-21,PT Indosat Tbk $ISAT menargetkan pertumbuhan pendapatan tahun ini mencapai 5-6 persen. Tahun 2023 nominal capex yang akan dikeluarkan $ISAT sebesar Rp13 triliun. #bebipinter #indosat,pt indosat tbk $isat menargetkan pertumbuhan pendapatan tahun ini mencapai 5-6 persen. tahun 2023 nominal capex yang akan dikeluarkan $isat sebesar rp13 triliun. #bebipinter #indosat,pt indosat tbk isat menargetkan pertumbuhan pendapatan tahun ini mencapai 56 persen tahun 2023 nominal capex yang akan dikeluarkan isat sebesar rp13 triliun bebipinter indosat,pt indosat tbk isat menargetkan pertumbuhan pendapatan tahun ini mencapai 56 persen tahun 2023 nominal lelah yang akan dikeluarkan isat sebesar rp13 triliun bebipinter indosat,pt indosat tbk isat menargetkan pertumbuhan pendapatan tahun mencapai 56 persen tahun 2023 nominal lelah akan dikeluarkan isat sebesar rp13 triliun bebipinter indosat,pt indosat tbk isat target tumbuh dapat tahun capai 56 persen tahun 2023 nominal lelah akan keluar isat besar rp13 triliun bebipinter indosat,"['pt', 'indosat', 'tbk', 'isat', 'target', 'tumbuh', 'dapat', 'tahun', 'capai', '56', 'persen', 'tahun', '2023', 'nominal', 'lelah', 'akan', 'keluar', 'isat', 'besar', 'rp13', 'triliun', 'bebipinter', 'indosat']","['pt', 'indosat', 'tbk', 'isat', 'target', 'grow', 'can', 'year', 'reach', '56', 'percent', 'year', '2023', 'nominal', 'tired', 'will', 'exit', 'isat', 'big', 'rp13', 'trillion', 'bebipinter', 'indosat']",0.8834,2
2023-03-01,Februari IHSG: 0.05% Case 1: -5.22% Case 2: -7.87% Catatan: Februari menurutku banyak false signal. Yang masih jalan dan untungnya cukup besar malah yang fundamentalnya kurang bagus seperti $HMSP dan $ISAT. Jadi kalah sama IHSG. https://t.co/C1kYY0ybk0,februari ihsg: 0.05% case 1: -5.22% case 2: -7.87% catatan: februari menurutku banyak false signal. yang masih jalan dan untungnya cukup besar malah yang fundamentalnya kurang bagus seperti $hmsp dan $isat. jadi kalah sama ihsg. https://t.co/c1kyy0ybk0,februari ihsg 005 case 1 522 case 2 787 catatan februari menurutku banyak false signal yang masih jalan dan untungnya cukup besar malah yang fundamentalnya kurang bagus seperti hmsp dan isat jadi kalah sama ihsg,februari ihsg 005 case 1 522 case 2 787 catatan februari menurutku banyak false signal yang masih jalan dan untungnya cukup besar malah yang fundamentalnya kurang bagus seperti hmsp dan isat jadi kalah sama ihsg,februari ihsg 005 case 1 522 case 2 787 catatan februari menurutku banyak false signal masih jalan untungnya cukup besar malah fundamentalnya kurang bagus hmsp isat jadi kalah sama ihsg,februari ihsg 005 case 1 522 case 2 787 catat februari turut banyak false signal masih jalan untung cukup besar malah fundamental kurang bagus hmsp isat jadi kalah sama ihsg,"['februari', 'ihsg', '005', 'case', '1', '522', 'case', '2', '787', 'catat', 'februari', 'turut', 'banyak', 'false', 'signal', 'masih', 'jalan', 'untung', 'cukup', 'besar', 'malah', 'fundamental', 'kurang', 'bagus', 'hmsp', 'isat', 'jadi', 'kalah', 'sama', 'ihsg']","['February', 'IHSG', '005', 'Case', '1', '522', 'Case', '2', '787', 'Record', 'February', 'participate', 'many', 'False', 'Signal', 'Still', 'still', 'Profit', 'enough' 'Hmsp', 'Isat', 'So', 'Losing', 'Same', 'IHSG']",0.3818,2
2023-05-16,Berita lain hari ini: - $PALM Berencana Buyback 1 46% Saham Perusahaan - $PTRO akan bagikan dividen dengan yield 20 7% - $INKP $ISAT $SMCB akan bagikan dividen dalam waktu dekat. Lengkapnya klik di : https://t.co/awRGfNUKDp,berita lain hari ini: - $palm berencana buyback 1 46% saham perusahaan - $ptro akan bagikan dividen dengan yield 20 7% - $inkp $isat $smcb akan bagikan dividen dalam waktu dekat. lengkapnya klik di : https://t.co/awrgfnukdp,berita lain hari ini palm berencana buyback 1 46 saham perusahaan ptro akan bagikan dividen dengan yield 20 7 inkp isat smcb akan bagikan dividen dalam waktu dekat lengkapnya klik di,berita lain hari ini palm berencana beli kembali 1 46 saham perusahaan ptro akan bagikan dividen dengan yield 20 7 inkp isat smcb akan bagikan dividen dalam waktu dekat lengkapnya klik di,berita hari palm berencana beli 1 46 saham perusahaan ptro bagikan dividen yield 20 7 inkp isat smcb bagikan dividen waktu dekat lengkapnya klik,berita hari palm rencana beli 1 46 saham usaha ptro bagi dividen yield 20 7 inkp isat smcb bagi dividen waktu dekat lengkap klik,"['berita', 'hari', 'palm', 'rencana', 'beli', '1', '46', 'saham', 'usaha', 'ptro', 'bagi', 'dividen', 'yield', '20', '7', 'inkp', 'isat', 'smcb', 'bagi', 'dividen', 'waktu', 'dekat', 'lengkap', 'klik']","['news',' day ',' palm ',' plan ',' buy ',' 1 ',' 46 ',' stock ',' business', 'ptro', 'for', 'dividend', 'yield', '20', '7', 'inkp', 'ISAT', 'SMCB', 'SMCB', 'SMCB', '",0.5423,2
2023-05-19,ISAT - BUY Berhasil Rebound dari Bottoming Area berpotensi melanjutkan penguatan Area beli terbaik pada range 7500- 7700 Stoploss jika Closing di bawah level 7300 *Disclaimer On $ISAT https://t.co/MoGKEdtQpQ,isat - buy berhasil rebound dari bottoming area berpotensi melanjutkan penguatan area beli terbaik pada range 7500- 7700 stoploss jika closing di bawah level 7300 *disclaimer on $isat https://t.co/mogkedtqpq,isat buy berhasil rebound dari bottoming area berpotensi melanjutkan penguatan area beli terbaik pada range 7500 7700 stoploss jika closing di bawah level 7300 disclaimer on isat,isat buy berhasil berbalik naik dari bottoming area berpotensi melanjutkan penguatan area beli terbaik pada range 7500 7700 stoploss jika closing di bawah level 7300 disclaimer on isat,isat buy berhasil berbalik naik bottoming area berpotensi melanjutkan penguatan area beli terbaik range 7500 7700 stoploss closing bawah level 7300 disclaimer on isat,isat buy hasil balik naik bottoming area potensi lanjut kuat area beli baik range 7500 7700 stoploss closing bawah level 7300 disclaimer on isat,"['isat', 'buy', 'hasil', 'balik', 'naik', 'bottoming', 'area', 'potensi', 'lanjut', 'kuat', 'area', 'beli', 'baik', 'range', '7500', '7700', 'stoploss', 'closing', 'bawah', 'level', '7300', 'disclaimer', 'on', 'isat']","['Isat', 'Buy', 'Results', 'Back', 'Rise', 'Bottoming', 'Area', 'Potential', 'Continue', 'Strong', 'Area', 'Buy', 'Buy', 'Good', 'Range', '7500', '7700', 'Stoploss', 'Closing', 'Closing', 'Closing', 'Closing', 'Closing', 'Closing', 'Closing', 'Closing', 'Closing', 'Closing', 'Closing', 'Closing', 'Closing', 'Closing', 'Closing', 'Closing', 'Closing' 'Isat']",0.9136,2
2023-05-26,Masalahnya tidak semua cust mau untuk membeli langganan  dengan minim 6 bulan banyak review nya di gmaps yang mengatakan demikian karena memang keberatan well played $ISAT,masalahnya tidak semua cust mau untuk membeli langganan  dengan minim 6 bulan banyak review nya di gmaps yang mengatakan demikian karena memang keberatan well played $isat,masalahnya tidak semua cust mau untuk membeli langganan  dengan minim 6 bulan banyak review nya di gmaps yang mengatakan demikian karena memang keberatan well played isat,masalahnya tidak semua cust mau untuk membeli langganan  dengan minim 6 bulan banyak review nya di gmaps yang mengatakan demikian karena memang keberatan well played isat,masalahnya semua cust mau membeli langganan  dengan minim 6 bulan banyak review nya gmaps mengatakan karena memang keberatan well played isat,masalah semua cust mau beli langgan  dengan minim 6 bulan banyak review nya gmaps kata karena memang berat well played isat,"['masalah', 'semua', 'cust', 'mau', 'beli', 'langgan', ' dengan', 'minim', '6', 'bulan', 'banyak', 'review', 'gmaps', 'kata', 'karena', 'memang', 'berat', 'well', 'played', 'isat']","['Problems', 'All', 'Cust', 'Want', 'Buy', 'Langgan', 'With', 'Minimal', '6', 'Month', 'Many', 'Review', 'His', 'Gmaps', 'Gmaps', 'said', 'because', 'indeed', 'Heavy', 'Well', 'Played', 'Isat']",0.5106,2
2023-05-27,@bintangselatann Pake kartu 3 $ISAT ajaaa haha. Murah lagi wkwk,@bintangselatann pake kartu 3 $isat ajaaa haha. murah lagi wkwk,bintangselatann pake kartu 3 isat ajaaa haha murah lagi wkwk,bintangselatann pake kartu 3 isat ajaaa haha murah lagi wkwk,bintangselatann pake kartu 3 isat ajaaa haha murah wkwk,bintangselatann pake kartu 3 isat ajaaa haha murah wkwk,"['bintangselatann', 'pake', 'kartu', '3', 'isat', 'ajaaa', 'haha', 'murah', 'wkwk']","['Bintangsanann', 'use', 'card', '3', 'isat', 'just', 'haha', 'cheap', 'wkwk']",0.4588,2
2023-05-29,Salah satu top gainers IHSG Year to Date. $ISAT kinerjanya YTD +30%. Alhamdulillah. Beli 100 juta maka sore kemarin floating profit 30 juta. Kami sudah posting juga di dalam channel gratis https://t.co/vyKSIpkxau https://t.co/CHiFNLNMYM,salah satu top gainers ihsg year to date. $isat kinerjanya ytd +30%. alhamdulillah. beli 100 juta maka sore kemarin floating profit 30 juta. kami sudah posting juga di dalam channel gratis https://t.co/vyksipkxau https://t.co/chifnlnmym,salah satu top gainers ihsg year to date isat kinerjanya ytd 30 alhamdulillah beli 100 juta maka sore kemarin floating profit 30 juta kami sudah posting juga di dalam channel gratis,salah satu top gainers ihsg year to date isat kinerjanya ytd 30 alhamdulillah beli 100 juta maka sore kemarin potensi rugi berjalan profit 30 juta kami sudah posting juga di dalam channel gratis,salah satu top gainers ihsg year to date isat kinerjanya ytd 30 alhamdulillah beli 100 juta sore kemarin potensi rugi berjalan profit 30 juta sudah posting di channel gratis,salah satu top gainers ihsg year to date isat kerja ytd 30 alhamdulillah beli 100 juta sore kemarin potensi rugi jalan profit 30 juta sudah posting di channel gratis,"['salah', 'satu', 'top', 'gainers', 'ihsg', 'year', 'to', 'date', 'isat', 'kerja', 'ytd', '30', 'alhamdulillah', 'beli', '100', 'juta', 'sore', 'kemarin', 'potensi', 'rugi', 'jalan', 'profit', '30', 'juta', 'sudah', 'posting', 'di', 'channel', 'gratis']","['Wrong', 'One', 'Top', 'Gainers', 'IHSG', 'Year', 'To', 'Date', 'Date', 'Isat', 'Work', 'Ytd', '30', 'Alhamdulillah', 'Buy', '100', 'Million', 'Million', 'yesterday', 'yesterday', 'yesterday' 'Post', 'on', 'Channel', 'Free']",0.4939,2
