date,full_text,lower,cleaned,normalized,stopword,steemed,tokens,text_en,vader_compound,vader_label
2021-09-17,Wkwkw sad bener $ISAT sobat FOMO,wkwkw sad bener $isat sobat fomo,wkwkw sad bener isat sobat fomo,wkwkw sad bener isat sobat fomo,wkwkw sad bener isat sobat fomo,wkwkw sad bener isat sobat fomo,"['wkwkw', 'sad', 'bener', 'isat', 'sobat', 'fomo']","['wkwkw', 'sad', 'right', 'isat', 'buddy', 'fomo']",-0.4767,1
2021-09-17,Setelah merger saham pemerintah di $ISAT terdilusi dari 14 6% menjadi tinggal 9 6%. Faktanya memang pemerintah fokus di $TLKM saja. Jadi wacana buyback (terhadap pemegang pengendali yang sekarang ada 2 pihak) seharusnya bisa dilupakan.,setelah merger saham pemerintah di $isat terdilusi dari 14 6% menjadi tinggal 9 6%. faktanya memang pemerintah fokus di $tlkm saja. jadi wacana buyback (terhadap pemegang pengendali yang sekarang ada 2 pihak) seharusnya bisa dilupakan.,setelah merger saham pemerintah di isat terdilusi dari 14 6 menjadi tinggal 9 6 faktanya memang pemerintah fokus di tlkm saja jadi wacana buyback terhadap pemegang pengendali yang sekarang ada 2 pihak seharusnya bisa dilupakan,setelah merger saham pemerintah di isat terdilusi dari 14 6 menjadi tinggal 9 6 faktanya memang pemerintah fokus di tlkm saja jadi wacana beli kembali terhadap pemegang pengendali yang sekarang ada 2 pihak seharusnya bisa dilupakan,merger saham pemerintah isat terdilusi 14 6 menjadi tinggal 9 6 faktanya memang pemerintah fokus tlkm jadi wacana beli terhadap pemegang pengendali sekarang 2 pihak bisa dilupakan,merger saham perintah isat lus 14 6 jadi tinggal 9 6 fakta memang perintah fokus tlkm jadi wacana beli hadap pegang kendali sekarang 2 pihak bisa lupa,"['merger', 'saham', 'perintah', 'isat', 'lus', '14', '6', 'jadi', 'tinggal', '9', '6', 'fakta', 'memang', 'perintah', 'fokus', 'tlkm', 'jadi', 'wacana', 'beli', 'hadap', 'pegang', 'kendali', 'sekarang', '2', 'pihak', 'bisa', 'lupa']","['Merger', 'Stock', 'Order', 'Isat', 'Lus',' 14 ',' 6 ',' So ',' Living ',' 9 ',' 6 ',' Fact ',' Indeed ',' Order ',' Focus', 'Focus',' Tlkm ',' So ',' Discourse ',' Buy ',' Face ',' 'forget']",0.0772,2
2021-09-17,@ilhamramda @gadtorade pemegang $ISAT lagi TP dulu,@ilhamramda @gadtorade pemegang $isat lagi tp dulu,ilhamramda gadtorade pemegang isat lagi tp dulu,ilhamramda gadtorade pemegang isat lagi tapi dulu,ilhamramda gadtorade pemegang isat tapi dulu,ilhamramda gadtorade pegang isat tapi dulu,"['ilhamramda', 'gadtorade', 'pegang', 'isat', 'tapi', 'dulu']","['Ilhamramda', 'Gadtorade', 'Hold', 'Isat', 'But', 'First']",0.0644,2
2021-10-29,@doktermarket Tahun lalu $ISAT juga banyak jual tower ke $TOWR tapi sebagian besar buat bayar pesangon hehe,@doktermarket tahun lalu $isat juga banyak jual tower ke $towr tapi sebagian besar buat bayar pesangon hehe,doktermarket tahun lalu isat juga banyak jual tower ke towr tapi sebagian besar buat bayar pesangon hehe,doktermarket tahun lalu isat juga banyak jual tower ke towr tapi sebagian besar buat bayar pesangon hehe,doktermarket tahun lalu isat banyak jual tower towr sebagian besar buat bayar pesangon hehe,doktermarket tahun lalu isat banyak jual tower towr bagi besar buat bayar upah hehe,"['doktermarket', 'tahun', 'lalu', 'isat', 'banyak', 'jual', 'tower', 'towr', 'bagi', 'besar', 'buat', 'bayar', 'upah', 'hehe']","['DokterMarket', 'Year', 'Then', 'Isat', 'Many', 'Selling', 'Tower', 'Tower', 'For', 'Big', 'Create', 'Pay', 'Sangon', 'Hehe']",0.2732,2
2021-11-10,@iklanlawak @triindonesia tetap idolaku ayo dong pada make kan udah merger dengan @IndosatOoredoo biar saham $FREN ku di @Stockbit naek terus maap $ISAT duit nya ga nyukup beli kamu https://t.co/ngJoMJJyYF,@iklanlawak @triindonesia tetap idolaku ayo dong pada make kan udah merger dengan @indosatooredoo biar saham $fren ku di @stockbit naek terus maap $isat duit nya ga nyukup beli kamu https://t.co/ngjomjjyyf,iklanlawak triindonesia tetap idolaku ayo dong pada make kan udah merger dengan indosatooredoo biar saham fren ku di stockbit naek terus maap isat duit nya ga nyukup beli kamu,iklanlawak triindonesia tetap idolaku ayo dong pada make kan udah merger dengan indosatooredoo biar saham fren ku di stockbit naik terus maap isat uang nya tidak nyukup beli kamu,iklanlawak triindonesia tetap idolaku ayo dong make kan udah merger indosatooredoo biar saham fren ku stockbit naik terus maap isat uang nya nyukup beli kamu,iklanlawak triindonesia tetap idola ayo dong make kan udah merger indosatooredoo biar saham fren ku stockbit naik terus maap isat uang nya nyukup beli kamu,"['iklanlawak', 'triindonesia', 'tetap', 'idola', 'ayo', 'dong', 'make', 'kan', 'udah', 'merger', 'indosatooredoo', 'biar', 'saham', 'fren', 'ku', 'stockbit', 'naik', 'terus', 'maaf', 'isat', 'uang', 'nyukup', 'beli', 'kamu']","['Advertising', 'Triindonesia', 'Stay', 'Idol', 'Ayo', 'Dong', 'Make', 'Kan', 'Igna', 'Mercer', 'IndosatoOnedoo', 'Leave', 'Stocks',' Fren ',' Ku ',' StockBit ',' Up ',' Continue ',' forgive ',' 'SUCCESS', 'BUY', 'YOU']",0.8208,2
2021-11-18,Another loss dari AFL Swing $ISAT. Susah sekali buat naik memang :) https://t.co/0o0N5t1hZZ,another loss dari afl swing $isat. susah sekali buat naik memang :) https://t.co/0o0n5t1hzz,another loss dari afl swing isat susah sekali buat naik memang,another loss dari afl strategi jangka pendek isat susah sekali buat naik memang,another loss afl strategi jangka pendek isat susah sekali buat naik memang,another loss afl strategi jangka pendek isat susah sekali buat naik memang,"['another', 'loss', 'afl', 'strategi', 'jangka pendek', 'isat', 'susah', 'sekali', 'buat', 'naik', 'memang']","['another', 'loss', 'afl', 'strategy', 'short term', 'isat', 'difficult', 'once', 'make', 'up', 'indeed']",-0.6486,1
2021-11-19,Merger Indosat-Tri Kominfo Bisa Optimalkan Pendapatan Negara https://t.co/NaZudiylVF $ISAT,merger indosat-tri kominfo bisa optimalkan pendapatan negara https://t.co/nazudiylvf $isat,merger indosattri kominfo bisa optimalkan pendapatan negara isat,merger indosattri kominfo bisa optimalkan pendapatan negara isat,merger indosattri kominfo optimalkan pendapatan negara isat,merger indosattri kominfo optimal dapat negara isat,"['merger', 'indosattri', 'kominfo', 'optimal', 'dapat', 'negara', 'isat']","['Merger', 'Indosattri', 'Kominfo', 'Optimal', 'Optimal', 'State', 'Isat']",0.6124,2
2021-11-26,Lumayan nih passive income even tho ngga paham saham nya beli aja setelah ex date jual lagi $ISAT https://t.co/bYLC7hy77d,lumayan nih passive income even tho ngga paham saham nya beli aja setelah ex date jual lagi $isat https://t.co/bylc7hy77d,lumayan nih passive income even tho ngga paham saham nya beli aja setelah ex date jual lagi isat,lumayan nih passive income even tho ngga paham saham nya beli aja setelah ex date jual lagi isat,lumayan nih passive income even tho ngga paham saham nya beli aja ex date jual isat,lumayan nih passive income even tho ngga paham saham nya beli aja ex date jual isat,"['lumayan', 'nih', 'passive', 'income', 'even', 'tho', 'ngga', 'paham', 'saham', 'beli', 'aja', 'ex', 'date', 'jual', 'isat']","['Not bad', 'here', 'passive', 'income', 'even', 'tho', 'no', 'not', 'understand', 'shares', 'shares', 'buy', 'buy', 'just', 'ex', 'date', 'Sell', 'Isat']",0.1134,2
2021-11-27,Sekaligus! Saham Indosat (IDX: $ISAT) Bagi Dividen 2 Kali Desember 2021 Ini Catat Jadwal &amp; Yield https://t.co/2FJQw5f5ID,sekaligus! saham indosat (idx: $isat) bagi dividen 2 kali desember 2021 ini catat jadwal &amp; yield https://t.co/2fjqw5f5id,sekaligus saham indosat idx isat bagi dividen 2 kali desember 2021 ini catat jadwal amp yield,sekaligus saham indosat idx isat bagi dividen 2 kali desember 2021 ini catat jadwal amp yield,sekaligus saham indosat idx isat dividen 2 kali desember 2021 catat jadwal amp yield,sekaligus saham indosat idx isat dividen 2 kali desember 2021 catat jadwal amp yield,"['sekaligus', 'saham', 'indosat', 'idx', 'isat', 'dividen', '2', 'kali', 'desember', '2021', 'catat', 'jadwal', 'amp', 'yield']","['at once', 'stock', 'indosat', 'idx', 'isat', 'dividend', '2', 'times', 'December', '2021', 'record', 'Schedule', 'Amp', 'Yield']",0.5574,2
2021-11-28,@cnbcindonesia saham IPO kali ini ga ada yang menarik. lebih pilih saham $ISAT  dengan dividen jumbo nya.,@cnbcindonesia saham ipo kali ini ga ada yang menarik. lebih pilih saham $isat  dengan dividen jumbo nya.,cnbcindonesia saham ipo kali ini ga ada yang menarik lebih pilih saham isat  dengan dividen jumbo nya,cnbcindonesia saham ipo kali ini tidak ada yang menarik lebih pilih saham isat  dengan dividen jumbo nya,cnbcindonesia saham ipo kali tidak yang menarik lebih pilih saham isat  dengan dividen jumbo nya,cnbcindonesia saham ipo kali tidak yang tarik lebih pilih saham isat  dengan dividen jumbo nya,"['cnbcindonesia', 'saham', 'ipo', 'kali', 'tidak', 'yang', 'tarik', 'lebih', 'pilih', 'saham', 'isat', ' dengan', 'dividen', 'jumbo', 'nya']","['CNBCIndonesia', 'Stock', 'IPO', 'Kali', 'No', 'No', 'Pull', 'More', 'Select', 'Stock', 'Isat', 'With', 'Dividend', 'Jumbo', 'His']",0.3182,2
2021-11-30,baru saja menjual semua saham di $BBCA $BBRI $ASII. jual rugi. uangnya utk memborong $ISAT. ALL IN. kalau saja rumah bisa dijual cepat mungkin sudah kujual jg tu buat beli $ISAT ,baru saja menjual semua saham di $bbca $bbri $asii. jual rugi. uangnya utk memborong $isat. all in. kalau saja rumah bisa dijual cepat mungkin sudah kujual jg tu buat beli $isat ,baru saja menjual semua saham di bbca bbri asii jual rugi uangnya utk memborong isat all in kalau saja rumah bisa dijual cepat mungkin sudah kujual jg tu buat beli isat,baru saja menjual semua saham di bbca bbri asii jual rugi uangnya untuk memborong isat all in kalau saja rumah bisa dijual cepat mungkin sudah kujual juga tu buat beli isat,baru menjual semua saham bbca bbri asii jual rugi uangnya memborong isat all in kalau rumah dijual cepat mungkin kujual tu buat beli isat,baru jual semua saham bbca bbri asi jual rugi uang borong isat all in kalau rumah jual cepat mungkin jual tu buat beli isat,"['baru', 'jual', 'semua', 'saham', 'bbca', 'bbri', 'asi', 'jual', 'rugi', 'uang', 'borong', 'isat', 'all', 'in', 'kalau', 'rumah', 'jual', 'cepat', 'mungkin', 'jual', 'tu', 'buat', 'beli', 'isat']","['new', 'selling', 'all', 'stock', 'BBCA', 'BBRI', 'ASI', 'Selling', 'Loss', 'Money', 'Borong', 'Isat', 'All', 'In', 'In', 'If', 'House', 'Selling', 'Fast', 'Fast', 'Possible', 'Sell', 'Tu', 'Create', 'Isat', 'Isat']",0.0,0
2021-11-30,$TLKM &amp; $ISAT sudah di post sebelumnya.,$tlkm &amp; $isat sudah di post sebelumnya.,tlkm amp isat sudah di post sebelumnya,tlkm amp isat sudah di post sebelumnya,tlkm amp isat di post sebelumnya,tlkm amp isat di post belum,"['tlkm', 'amp', 'isat', 'di', 'post', 'belum']","['tlkm', 'amp', 'isat', 'in', 'post', 'not yet']",0.0,0
2021-12-02,@cnbcindonesia sudah cutloss di $PTBA duitnya buat beli $ISAT.,@cnbcindonesia sudah cutloss di $ptba duitnya buat beli $isat.,cnbcindonesia sudah cutloss di ptba duitnya buat beli isat,cnbcindonesia sudah jual rugi di ptba uangnya buat beli isat,cnbcindonesia jual rugi ptba uangnyanya buat beli isat,cnbcindonesia jual rugi ptba uang buat beli isat,"['cnbcindonesia', 'jual', 'rugi', 'ptba', 'uang', 'buat', 'beli', 'isat']","['CNBCIndonesia', 'Selling', 'Loss', 'PTBA', 'Money', 'Create', 'Buy', 'Isat']",0.1779,2
2021-12-03,$ISAT akan membagikan dividen dengan total nilai mencapai Rp9 5 triliun (setara Rp1.748 27/saham) yang terdiri dari dividen tahunan sejumlah Rp4 5 triliun dan dividen interim sejumlah Rp4 99 triliun. Berdasarkan harga penutupan 2/12/21 yield dividen mencapai 22 49%. https://t.co/ETnmURLN5m,$isat akan membagikan dividen dengan total nilai mencapai rp9 5 triliun (setara rp1.748 27/saham) yang terdiri dari dividen tahunan sejumlah rp4 5 triliun dan dividen interim sejumlah rp4 99 triliun. berdasarkan harga penutupan 2/12/21 yield dividen mencapai 22 49%. https://t.co/etnmurln5m,isat akan membagikan dividen dengan total nilai mencapai rp9 5 triliun setara rp1748 27saham yang terdiri dari dividen tahunan sejumlah rp4 5 triliun dan dividen interim sejumlah rp4 99 triliun berdasarkan harga penutupan 21221 yield dividen mencapai 22 49,isat akan membagikan dividen dengan total nilai mencapai rp9 5 triliun setara rp1748 27saham yang terdiri dari dividen tahunan sejumlah rp4 5 triliun dan dividen interim sejumlah rp4 99 triliun berdasarkan harga penutupan 21221 yield dividen mencapai 22 49,isat membagikan dividen total nilai mencapai rp9 5 triliun setara rp1748 27saham terdiri dividen tahunan sejumlah rp4 5 triliun dividen interim sejumlah rp4 99 triliun berdasarkan harga penutupan 21221 yield dividen mencapai 22 49,isat bagi dividen total nilai capai rp9 5 triliun tara rp1748 27saham diri dividen tahun jumlah rp4 5 triliun dividen interim jumlah rp4 99 triliun dasar harga tutup 21221 yield dividen capai 22 49,"['isat', 'bagi', 'dividen', 'total', 'nilai', 'capai', 'rp9', '5', 'triliun', 'tara', 'rp1748', '27saham', 'diri', 'dividen', 'tahun', 'jumlah', 'rp4', '5', 'triliun', 'dividen', 'interim', 'jumlah', 'rp4', '99', 'triliun', 'dasar', 'harga', 'tutup', '21221', 'yield', 'dividen', 'capai', '22', '49']","['Isat', 'for', 'dividend', 'total', 'value', 'tired', 'Rp9', '5', 'trillion', 'tara', 'Rp1748', '27saham', 'self', 'dividend', 'year', 'amount', 'Rp4', '5' 'trillion', 'basic', 'price', 'closed', '21221', 'yield', 'dividend', 'tired', '22', '49']",0.3642,2
2021-12-04,Buat yang ngejar dividen $ISAT 22% Here's some advice. Hati-hati dengan dividen trap. Kemungkinan terburuknya adalah kena ARB berjilid jilid. Asumsi ARB 7% Dengan dividen 22% butuh arb sebanyak 4x untuk ngebuat kalian rugi. Ingat itu cuma kemungkinan terburuk ,buat yang ngejar dividen $isat 22% here's some advice. hati-hati dengan dividen trap. kemungkinan terburuknya adalah kena arb berjilid jilid. asumsi arb 7% dengan dividen 22% butuh arb sebanyak 4x untuk ngebuat kalian rugi. ingat itu cuma kemungkinan terburuk ,buat yang ngejar dividen isat 22 heres some advice hatihati dengan dividen trap kemungkinan terburuknya adalah kena arb berjilid jilid asumsi arb 7 dengan dividen 22 butuh arb sebanyak 4x untuk ngebuat kalian rugi ingat itu cuma kemungkinan terburuk,buat yang ngejar dividen isat 22 heres some advice hatihati dengan dividen jebakan kemungkinan terburuknya adalah kena arb berjilid jilid asumsi arb 7 dengan dividen 22 butuh arb sebanyak 4x untuk ngebuat kalian rugi ingat itu hanya kemungkinan terburuk,buat ngejar dividen isat 22 heres some advice hatihati dividen jebakan kemungkinan terburuknya kena arb berjilid jilid asumsi arb 7 dividen 22 butuh arb sebanyak 4x ngebuat kalian rugi ingat hanya kemungkinan terburuk,buat ngejar dividen isat 22 heres some advice hatihati dividen jebak mungkin buruk kena arb jilid jilid asumsi arb 7 dividen 22 butuh arb banyak 4x ngebuat kalian rugi ingat hanya mungkin buruk,"['buat', 'ngejar', 'dividen', 'isat', '22', 'heres', 'some', 'advice', 'hatihati', 'dividen', 'jebak', 'mungkin', 'buruk', 'kena', 'arb', 'jilid', 'jilid', 'asumsi', 'arb', '7', 'dividen', '22', 'butuh', 'arb', 'banyak', '4x', 'ngebuat', 'kalian', 'rugi', 'ingat', 'hanya', 'mungkin', 'buruk']","['for', 'chasing', 'dividend', 'isat', '22', 'hes', 'Some', 'Advice', 'Hatihati', 'Dividend', 'Dividend', 'Dividend', 'maybe', 'Bad', 'hit', 'Arb', 'Volume', 'Volume', 'Volume', 'Assumption', 'ARB', '7', 'Dividend', 'Dividend' 'Arb', 'many', '4x', 'making', 'you', 'loss', 'remember', 'just', 'maybe', 'bad']",0.6124,2
2021-12-05,galau. senin hari penentuan. lepas. atau genggam.  dengan segala untung ruginya. $ISAT,galau. senin hari penentuan. lepas. atau genggam.  dengan segala untung ruginya. $isat,galau senin hari penentuan lepas atau genggam  dengan segala untung ruginya isat,bingung senin hari penentuan lepas atau genggam  dengan segala untung ruginya isat,bingung senin hari penentuan lepas genggam  dengan segala untung ruginya isat,bingung senin hari tentu lepas genggam  dengan segala untung rugi isat,"['bingung', 'senin', 'hari', 'tentu', 'lepas', 'genggam', ' dengan', 'segala', 'untung', 'rugi', 'isat']","['confused', 'Monday', 'day', 'of course', 'release', 'handheld', 'with', 'everything', 'profit', 'loss', 'Isat']",-0.3818,1
2021-12-05,jika dilepas  dengan harga skrg keuntungannya: tidak terkena dividen trap uang bisa langsung cair dan bisa digunakan utk yang lain. kerugiannya tidak mendapat dividen dan capital gain-nya kecil (hanya sekitar 1%). $ISAT,jika dilepas  dengan harga skrg keuntungannya: tidak terkena dividen trap uang bisa langsung cair dan bisa digunakan utk yang lain. kerugiannya tidak mendapat dividen dan capital gain-nya kecil (hanya sekitar 1%). $isat,jika dilepas  dengan harga skrg keuntungannya tidak terkena dividen trap uang bisa langsung cair dan bisa digunakan utk yang lain kerugiannya tidak mendapat dividen dan capital gainnya kecil hanya sekitar 1 isat,jika dilepas  dengan harga jangan keuntungannya tidak terkena dividen jebakan uang bisa langsung cair dan bisa digunakan untuk yang lain kerugiannya tidak mendapat dividen dan capital gainnya kecil hanya sekitar 1 isat,dilepas  dengan harga jangan keuntungannya terkena dividen jebakan uang langsung cair bisa digunakan yang kerugiannya mendapat dividen capital gainnya kecil sekitar 1 isat,lepas  dengan harga jangan untung kena dividen jebak uang langsung cair bisa guna yang rugi dapat dividen capital gain kecil sekitar 1 isat,"['lepas', ' dengan', 'harga', 'jangan', 'untung', 'kena', 'dividen', 'jebak', 'uang', 'langsung', 'cair', 'bisa', 'guna', 'yang', 'rugi', 'dapat', 'dividen', 'capital', 'gain', 'kecil', 'sekitar', '1', 'isat']","['release', 'with', 'price', 'do not', 'profit', 'hit', 'dividend', 'broken', 'money', 'direct', 'liquid', 'can', 'use', 'that', 'loss', 'can', 'dividend', 'capital', 'gain', 'small', 'around', '1', '1', 'Isat']",-0.3442,1
2021-12-06,akhirnya sudah saya jual semua saham $ISAT yang saya punya. meskipun gagal dapat dividen jumbo tetap bersyukur berarti memang hanya segini rezeki saya. sampai jumpa lagi di lain waktu. saya mau pindah ke saham yang lain dulu. terima kasih. https://t.co/XRNopMjz7N,akhirnya sudah saya jual semua saham $isat yang saya punya. meskipun gagal dapat dividen jumbo tetap bersyukur berarti memang hanya segini rezeki saya. sampai jumpa lagi di lain waktu. saya mau pindah ke saham yang lain dulu. terima kasih. https://t.co/xrnopmjz7n,akhirnya sudah saya jual semua saham isat yang saya punya meskipun gagal dapat dividen jumbo tetap bersyukur berarti memang hanya segini rezeki saya sampai jumpa lagi di lain waktu saya mau pindah ke saham yang lain dulu terima kasih,akhirnya sudah saya jual semua saham isat yang saya punya meskipun gagal dapat dividen jumbo tetap bersyukur berarti memang hanya segini rezeki saya sampai jumpa lagi di lain waktu saya mau pindah ke saham yang lain dulu terima kasih,akhirnya jual semua saham isat punya meskipun gagal dividen jumbo tetap bersyukur berarti memang segini rezeki saya sampai jumpa di waktu saya mau pindah saham lain dulu terima kasih,akhir jual semua saham isat punya meski gagal dividen jumbo tetap syukur arti memang gin rezeki saya sampai jumpa di waktu saya mau pindah saham lain dulu terima kasih,"['akhir', 'jual', 'semua', 'saham', 'isat', 'punya', 'meski', 'gagal', 'dividen', 'jumbo', 'tetap', 'syukur', 'arti', 'memang', 'gin', 'rezeki', 'saya', 'sampai', 'jumpa', 'di', 'waktu', 'saya', 'mau', 'pindah', 'saham', 'lain', 'dulu', 'terima', 'kasih']","['end', 'selling', 'all', 'stock', 'isat', 'have', 'though', 'failed', 'dividend', 'jumbo', 'still', 'gratitude', 'meaning', 'indeed', 'gin', 'sustenance', 'me', 'until', 'meet', ' 'Thank You']",0.5859,2
2021-12-07,$ISAT ARB 1x masih aman kalo udah 3x mulai keringet dingin wkwkw https://t.co/S9JasDpaL9,$isat arb 1x masih aman kalo udah 3x mulai keringet dingin wkwkw https://t.co/s9jasdpal9,isat arb 1x masih aman kalo udah 3x mulai keringet dingin wkwkw,isat arb 1x masih aman kalo udah 3x mulai keringet dingin wkwkw,isat arb 1x aman kalo udah 3x mulai keringet dingin wkwkw,isat arb 1x aman kalo udah 3x mulai keringet dingin wkwkw,"['isat', 'arb', '1x', 'aman', 'kalo', 'udah', '3x', 'mulai', 'keringet', 'dingin', 'wkwkw']","['Isat', 'Arb', '1x', 'Safe', 'If', 'Already', '3x', 'Start', 'Cleaning', 'Cold', 'Wkwkw']]",0.4404,2
2021-12-07,@ajaib_investasi 1 jutaan di $WIKA aku jual rugi buat beli $ISAT pas bullish kemarin. keuntungan dari njual $ISAT sudah bisa nutup kerugian di $WIKA. lebih dikit.,@ajaib_investasi 1 jutaan di $wika aku jual rugi buat beli $isat pas bullish kemarin. keuntungan dari njual $isat sudah bisa nutup kerugian di $wika. lebih dikit.,ajaib_investasi 1 jutaan di wika aku jual rugi buat beli isat pas bullish kemarin keuntungan dari njual isat sudah bisa nutup kerugian di wika lebih dikit,ajaib_investasi 1 jutaan di wika aku jual rugi buat beli isat pas bullish kemarin keuntungan dari njual isat sudah bisa tutup kerugian di wika lebih dikit,ajaib_investasi 1 jutaan wika aku jual rugi buat beli isat pas bullish kemarin keuntungan njual isat bisa tutup kerugian wika lebih dikit,ajaib investasi 1 juta wika aku jual rugi buat beli isat pas bullish kemarin untung njual isat bisa tutup rugi wika lebih dikit,"['ajaib', 'investasi', '1', 'juta', 'wika', 'aku', 'jual', 'rugi', 'buat', 'beli', 'isat', 'pas', 'bullish', 'kemarin', 'untung', 'njual', 'isat', 'bisa', 'tutup', 'rugi', 'wika', 'lebih', 'dikit']","['Magic', 'Investment', '1', 'Million', 'Wika', 'I', 'Sell', 'Loss',' Make ',' Buy ',' Isat ',' PAS ',' Bullish ',' Car ',' Fortunately ',' Njema ',' Isat ',' Can ',' Cover ',' Loss', '",-0.3182,1
2021-12-08,$ISAT ARB ke-2 syudah mulai panik belum? https://t.co/UUQuH4InCV,$isat arb ke-2 syudah mulai panik belum? https://t.co/uuquh4incv,isat arb ke2 syudah mulai panik belum,isat arb ke2 sudah mulai panik belum,isat arb ke2 sudah mulai panik,isat arb ke2 sudah mulai panik,"['isat', 'arb', 'ke2', 'sudah', 'mulai', 'panik']","['Isat', 'Arb', 'to', 'done', 'Start', 'Panic']",-0.5106,1
2021-12-10,Ayoo... naek trus ARA sampe 20x deh $WGSH buat nutupin minusnya dividen trap $ISAT https://t.co/0zZLzB6RHR,ayoo... naek trus ara sampe 20x deh $wgsh buat nutupin minusnya dividen trap $isat https://t.co/0zzlzb6rhr,ayoo naek trus ara sampe 20x deh wgsh buat nutupin minusnya dividen trap isat,ayoo naik terus naik maksimal sampe 20x deh wgsh buat nutupin minusnya dividen jebakan isat,ayoo naik terus naik maksimal sampe 20x deh wgsh buat nutupin minusnya dividen jebakan isat,ayoo naik terus naik maksimal sampe 20x deh wgsh buat nutupin minus dividen jebak isat,"['ayoo', 'naik', 'terus', 'naik', 'maksimal', 'sampe', '20x', 'wgsh', 'buat', 'nutupin', 'minus', 'dividen', 'jebak', 'isat']","['Ayoo', 'Ride', 'then', 'Rise', 'Maximum', 'SAME', '20X', 'Wgsh', 'Create', 'Cover', 'Minus', 'Dividend', 'trap', 'Isat']",0.7906,2
2021-12-13,$TLKM $ISAT $EXCL $ERAA $FREN https://t.co/Q6zKW2s2 dengan #KimGoEun #settingan,$tlkm $isat $excl $eraa $fren https://t.co/q6zkw2s2 dengan #kimgoeun #settingan,tlkm isat excl eraa fren kimgoeun settingan,tlkm isat excl eraa fren kimgoeun settingan,tlkm isat excl eraa fren kimgoeun settingan,tlkm isat excl eraa fren kimgoeun settingan,"['tlkm', 'isat', 'excl', 'eraa', 'fren', 'kimgoeun', 'settingan']","['tlkmm, 'isat','excl', 'eraa' 'kimgoeun','settings']",0.0,0
2021-12-16,makasih $ISAT,makasih $isat,makasih isat,makasih isat,makasih isat,makasih isat,"['makasih', 'isat']","['thanks', 'Isat']",0.4404,2
2021-12-16,Dividen $ISAT udah masuk ke RDN. ,dividen $isat udah masuk ke rdn. ,dividen isat udah masuk ke rdn,dividen isat udah masuk ke rdn,dividen isat udah masuk rdn,dividen isat udah masuk rdn,"['dividen', 'isat', 'udah', 'masuk', 'rdn']","['dividend', 'isat', 'already', 'enter', 'RDN']",0.3612,2
2021-12-20,$ISAT terbang terus padahal dulu pernah trauma sama saham ini. Beli di 4ribuan terus dibawa ke 3ribuan. Sekarang malah hampir dua kali lipat wkwkw,$isat terbang terus padahal dulu pernah trauma sama saham ini. beli di 4ribuan terus dibawa ke 3ribuan. sekarang malah hampir dua kali lipat wkwkw,isat terbang terus padahal dulu pernah trauma sama saham ini beli di 4ribuan terus dibawa ke 3ribuan sekarang malah hampir dua kali lipat wkwkw,isat naik terus padahal dulu pernah trauma sama saham ini beli di 4ribuan terus dibawa ke 3ribuan sekarang malah hampir dua kali lipat wkwkw,isat naik terus padahal dulu pernah trauma sama saham beli 4ribuan terus dibawa 3ribuan sekarang malah hampir kali lipat wkwkw,isat naik terus padahal dulu pernah trauma sama saham beli 4ribuan terus bawa 3ribuan sekarang malah hampir kali lipat wkwkw,"['isat', 'naik', 'terus', 'padahal', 'dulu', 'pernah', 'trauma', 'sama', 'saham', 'beli', '4ribuan', 'terus', 'bawa', '3ribuan', 'sekarang', 'malah', 'hampir', 'kali', 'lipat', 'wkwkw']","['Isat', 'Ride', 'Continue', 'In fact', 'used to', 'ever', 'trauma', 'the same', 'shares', 'buy', '4 thousand', 'continue', 'bring', '3 thousand', 'now', 'almost', 'almost', 'fold', 'Wkwkw']",0.0442,0
