date,full_text,lower,cleaned,normalized,stopword,steemed,tokens,text_en,vader_compound,vader_label
2019-01-04,Will Indosat Tbk PT Continue its Slide? $ISAT https://t.co/3HXZaWlgoz,will indosat tbk pt continue its slide? $isat https://t.co/3hxzawlgoz,will indosat tbk pt continue its slide isat,will indosat tbk pt continue its slide isat,will indosat tbk pt continue its slide isat,will indosat tbk pt continue its slide isat,"['will', 'indosat', 'tbk', 'pt', 'continue', 'its', 'slide', 'isat']","['will', 'indosat', 'tbk', 'pt', 'continue', 'its', 'slide', 'isat']",0.0,0
2019-02-11,$isat rasa gorengan nih.,$isat rasa gorengan nih.,isat rasa gorengan nih,isat rasa gorengan nih,isat rasa gorengan nih,isat rasa goreng nih,"['isat', 'rasa', 'goreng', 'nih']","['isat', 'taste', 'fried', 'nih']",0.0,0
2019-02-12,$isat nya anteng :( $antm nya ambyar $adro nya menggeliat.,$isat nya anteng :( $antm nya ambyar $adro nya menggeliat.,isat nya anteng antm nya hancur adro nya menggeliat,isat nya diam antm nya hancur adro nya menggeliat,isat nya diam antm nya hancur adro nya menggeliat,isat nya diam antm nya hancur adro nya geliat,"['isat', 'diam', 'antm', 'hancur', 'adro', 'geliat']","['isat', 'diam', 'antm', 'holrow', ' adro', the mighty']",0.0,0
2019-02-12,@novanict iya iki ming iseh nyantol $isat iki marai mumet,@novanict iyo iki ming iseh nyantol $isat iki marai mumet,novanict iyo iki ming iseh nyantol isat iki marai mumet,novanict iya iki ming masih tahan isat ini bikin pusing,novanict iya ini ming tahan isat ini bikin pusing,novanict iya ini ming tahan isat ini bikin pusing,"['novanict', 'iya', 'ini', 'ming', 'tahan', 'isat', 'ini', 'bikin', 'pusing']","['Novanict', 'yes', 'this', 'ming', 'resist', 'isat', 'this', 'make', 'dizzy']",0.2023,2
2019-02-14,Waaaa asekkk $isat ayoooo nanjakkkkk cc: @novanict,waaaa asekkk $isat ayoooo nanjakkkkk cc: @novanict,waaaa asekkk isat ayoooo nanjakkkkk cc novanict,waaaa asik isat ayoooo naik cc novanict,wah asik isat ayo naik cc novanict,wah asik isat ayo naik cc novanict,"['wah', 'asik', 'isat', 'ayo', 'naik', 'cc', 'novanict']","['wow', 'cool', 'isat', 'come on', 'ride', 'cc', 'Novanict']",0.5267,2
2019-02-15,@GustikurniaJ entahlah wkwk. katanya sih karena rumor merger $FREN sama $ISAT goks gak sih smartfren sama indosat. Baru aja gandeng Bolt saham SF jadinya naik terus. sekarang kalo jadi merger sinyal di Indonesia dikuasai Telkomsel XL Axiata 3 sama SF dong. waaaaaah menarik inih.,@gustikurniaj entahlah wkwk. katanya sih karena rumor merger $fren sama $isat goks gak sih smartfren sama indosat. baru aja gandeng bolt saham sf jadinya naik terus. sekarang kalo jadi merger sinyal di indonesia dikuasai telkomsel xl axiata 3 sama sf dong. waaaaaah menarik inih.,gustikurniaj entahlah wkwk katanya sih karena rumor merger fren sama isat goks gak sih smartfren sama indosat baru aja gandeng bolt saham sf jadinya naik terus sekarang kalo jadi merger sinyal di indonesia dikuasai telkomsel xl axiata 3 sama sf dong waaaaaah menarik inih,gustikurniaj entahlah wkwk katanya sih karena rumor merger fren sama isat goks tidak sih smartfren sama indosat baru aja gandeng bolt saham sf jadinya naik terus sekarang kalo jadi merger sinyal di indonesia dikuasai telkomsel xl axiata 3 sama sf dong wah menarik inih,gustikurniaj entahlah wkwk katanya sih rumor merger fren sama isat goks sih smartfren sama indosat baru aja gandeng bolt saham sf jadinya naik terus sekarang kalo jadi merger sinyal indonesia dikuasai telkomsel xl axiata 3 sama sf dong wah menarik inih,gustikurniaj entah wkwk kata sih rumor merger fren sama isat goks sih smartfren sama indosat baru aja gandeng bolt saham sf jadi naik terus sekarang kalo jadi merger sinyal indonesia asai telkomsel xl axiata 3 sama sf dong wah tarik inih,"['gustikurniaj', 'entah', 'wkwk', 'kata', 'sih', 'rumor', 'merger', 'fren', 'sama', 'isat', 'goks', 'sih', 'smartfren', 'sama', 'indosat', 'baru', 'aja', 'gandeng', 'bolt', 'saham', 'sf', 'jadi', 'naik', 'terus', 'sekarang', 'kalo', 'jadi', 'merger', 'sinyal', 'indonesia', 'asai', 'telkomsel', 'xl', 'axiata', '3', 'sama', 'sf', 'dong', 'wah', 'tarik', 'inih']","['Gustikurniaj', 'Either', 'wkwk', 'said', 'anyway', 'rumor', 'merger', 'Fren', 'Same', 'Isat', 'Goks',' Sih ',' Smartfren ',' Same ',' Indosat ',' New ',' Just ',' Just "" 'Continue', 'now', 'if', 'So', 'Merger', 'Signal', 'Indonesia', 'Asai', 'Telkomsel', 'Xl', 'Axiata', '3', '3', 'Same', 'Sama', 'SF', 'SF', 'SF', 'Dong', 'Wah', 'Pull', 'This']",0.0516,2
2019-04-04,$ISAT chart https://t.co/VsAhvJzcWh via https://t.co/vMJZxzZRcn hati-hati jangan sampai sangkut.kut..kut.. #Indosat just for trade,$isat chart https://t.co/vsahvjzcwh via https://t.co/vmjzxzzrcn hati-hati jangan sampai sangkut.kut..kut.. #indosat just for trade,isat chart via hatihati jangan sampai sangkutkutkut indosat just for trade,isat chart via hati hati jangan sampai terjebak indosat just for trade,isat chart via hati hati jangan terjebak indosat just for trade,isat chart via hati hati jangan jebak indosat just for trade,"['isat', 'chart', 'via', 'hati hati', 'jangan', 'jebak', 'indosat', 'just', 'for', 'trade']","['Isat', 'Chart', 'Via', 'be carefull', 'Don't', 'trap', 'Indosat', 'Just', 'For', 'Trade']",0.0,0
2019-05-10,Pembahasan $ISAT di @cnbcindonesia 02 Mei 2019. https://t.co/izf3CEuncG,pembahasan $isat di @cnbcindonesia 02 mei 2019. https://t.co/izf3ceuncg,pembahasan isat di cnbcindonesia 02 mei 2019,pembahasan isat di cnbcindonesia 02 mei 2019,pembahasan isat cnbcindonesia 02 mei 2019,bahas isat cnbcindonesia 02 mei 2019,"['bahas', 'isat', 'cnbcindonesia', '02', 'mei', '2019']","['discuss', 'Isat', 'CNBCIndonesia', '02', 'May', '2019']",0.0,0
2019-05-21,$ISAT #Indosat Indonesia Daily - Tuesday May 21 2019: Indosat (ISAT IJ/HOLD/Rp1 765/Target: Rp1 700): Revenue driven by data traffic; expect opex to rise. TRADERS CORNER Telekomunikasi Indonesia (TLKM IJ): Technical BUY Bank Tabungan Negara (BBTN IJ): https://t.co/3tSnzbzLwj https://t.co/ZRhxLvhxhR,$isat #indosat indonesia daily - tuesday may 21 2019: indosat (isat ij/hold/rp1 765/target: rp1 700): revenue driven by data traffic; expect opex to rise. traders corner telekomunikasi indonesia (tlkm ij): technical buy bank tabungan negara (bbtn ij): https://t.co/3tsnzbzlwj https://t.co/zrhxlvhxhr,isat indosat indonesia daily tuesday may 21 2019 indosat isat ijholdrp1 765target rp1 700 revenue driven by data traffic expect opex to rise traders corner telekomunikasi indonesia tlkm ij technical buy bank tabungan negara bbtn ij,isat indosat indonesia daily tuesday may 21 2019 indosat isat ijholdrp1 765target rp1 700 revenue driven by data traffic expect opex to rise traders corner telekomunikasi indonesia tlkm ij technical buy bank tabungan negara bbtn ij,isat indosat indonesia daily tuesday may 21 2019 indosat isat ijholdrp1 765target rp1 700 revenue driven by data traffic expect opex to rise traders corner telekomunikasi indonesia tlkm ij technical buy bank tabungan negara bbtn ij,isat indosat indonesia daily tuesday may 21 2019 indosat isat ijholdrp1 765target rp1 700 revenue driven by data traffic expect opex to rise traders corner telekomunikasi indonesia tlkm ij technical buy bank tabung negara bbtn ij,"['isat', 'indosat', 'indonesia', 'daily', 'tuesday', 'may', '21', '2019', 'indosat', 'isat', 'ijholdrp1', '765target', 'rp1', '700', 'revenue', 'driven', 'by', 'data', 'traffic', 'expect', 'opex', 'to', 'rise', 'traders', 'corner', 'telekomunikasi', 'indonesia', 'tlkm', 'ij', 'technical', 'buy', 'bank', 'tabung', 'negara', 'bbtn', 'ij']","['Isat', 'Indosat', 'Indonesia', 'Daily', 'Tuesday', 'May', '21', '2019', 'Indosat', 'Isat', 'Ijholdrp1', '765Target', 'RP1', '700', '700' 'Opex', 'to', 'Rise', 'Traders', 'Corner', 'Telecommunications', 'Indonesia', 'Tlkm', 'Imit', 'Technical', 'Technical', 'Buy', 'BUY', 'Bank', 'Bank', 'Bank', 'Tube', 'Country', 'BBTN', 'Permission']",0.7739,2
2019-06-24,@IDX_BEI Min indosatooredoo na meureun min. $ISAT,@idx_bei min indosatooredoo na meureun min. $isat,idx_bei min indosatooredoo na meureun min isat,idx_bei min indosatooredoo na meureun min isat,idx_bei min indosatooredoo na meureun min isat,idx bei min indosatooredoo na meureun min isat,"['idx', 'bei', 'min', 'indosatooredoo', 'na', 'meureun', 'min', 'isat']","['idx', 'wome', 'Indosatooro', 'meureun', 'mine', 'isat'",0.0,0
2019-08-26,$ISAT lempeng banget dah ,$isat lempeng banget dah ,isat lempeng banget dah,isat datar banget dah,isat datar banget dah,isat datar banget dah,"['isat', 'datar', 'banget', 'dah']","['isat', 'flat', 'banget', 'dah']",-0.128,1
2019-09-08,@IDX_BEI $TLKM $ISAT $MYOR $INDF $AMRT,@idx_bei $tlkm $isat $myor $indf $amrt,idx_bei tlkm isat myor indf amrt,idx_bei tlkm isat myor indf amrt,idx_bei tlkm isat myor indf amrt,idx bei tlkm isat myor indf amrt,"['idx', 'bei', 'tlkm', 'isat', 'myor', 'indf', 'amrt']","['IDX', 'Bei', 'Tlkm', 'Isat', 'Myor', 'Indf', 'Amrt']",0.0,0
2019-12-05,lama lama naksir $ISAT nih buat daily-weekly,lama lama naksir $isat nih buat daily-weekly,lama lama naksir isat nih buat dailyweekly,lama lama naksir isat nih buat dailyweekly,lama lama naksir isat nih buat dailyweekly,lama lama naksir isat nih buat dailyweekly,"['lama', 'lama', 'naksir', 'isat', 'nih', 'buat', 'dailyweekly']","['old', 'old', 'crush', 'Isat', 'here', 'Create', 'Dailyweekly']",0.128,2
2020-01-24,ISAT udah mulai pick up. RSI Stochastic udah oversold. Walaupun masih ada next support di 2170. #ISAT $ISAT https://t.co/2v17q6x3C8,isat udah mulai pick up. rsi stochastic udah oversold. walaupun masih ada next support di 2170. #isat $isat https://t.co/2v17q6x3c8,isat udah mulai pick up rsi stochastic udah oversold walaupun masih ada next support di 2170 isat isat,isat udah mulai pick up rsi indikator teknikal udah harga turun terlalu dalam walaupun masih ada next support di 2170 isat isat,isat udah mulai pick up rsi indikator teknikal udah harga turun terlalu walaupun ada next support 2170 isat isat,isat udah mulai pick up rsi indikator teknikal udah harga turun terlalu walaupun ada next support 2170 isat isat,"['isat', 'udah', 'mulai', 'pick', 'up', 'rsi', 'indikator', 'teknikal', 'udah', 'harga', 'turun', 'terlalu', 'walaupun', 'ada', 'next', 'support', '2170', 'isat', 'isat']","['Isat', 'already', 'started', 'pick', 'up', 'Rsi', 'indicator', 'technical', 'already', 'price', 'down', 'too', 'though', 'there', 'Next', 'support', '2170', 'Isat']",-0.1531,1
2020-01-28,$PAMG pernah beli diharga 50 dan 50an untungnya dipake beli $ISAT eh malah rugi. Tak paham lagi aku membedakan saham yang bagus atau tidak. Sama aja kayaknya. https://t.co/YQ0KQVme0c,$pamg pernah beli diharga 50 dan 50an untungnya dipake beli $isat eh malah rugi. tak paham lagi aku membedakan saham yang bagus atau tidak. sama aja kayaknya. https://t.co/yq0kqvme0c,pamg pernah beli diharga 50 dan 50an untungnya dipake beli isat eh malah rugi tak paham lagi aku membedakan saham yang bagus atau tidak sama aja kayaknya,pamg pernah beli diharga 50 dan 50an untungnya dipake beli isat eh malah rugi tak paham lagi aku membedakan saham yang bagus atau tidak sama aja kayaknya,pamg pernah beli diharga 50 50an untungnya dipake beli isat eh malah rugi ngga paham aku membedakan saham bagus tidak sama aja kayaknya,pamg pernah beli harga 50 50an untung dipake beli isat eh malah rugi tak paham aku beda saham bagus tidak sama aja kayak,"['pamg', 'pernah', 'beli', 'harga', '50', '50an', 'untung', 'dipake', 'beli', 'isat', 'malah', 'rugi', 'tak', 'paham', 'aku', 'beda', 'saham', 'bagus', 'tidak', 'sama', 'aja', 'kayak']","['pamg', 'ever', 'buy', 'price', '50', '50s', 'profit', 'use', 'buy', 'Isat', 'instead', 'loss', 'no', 'understand', 'I', 'Different', 'Different', 'Good', 'No', 'Same', 'Just',)",0.8074,2
2020-01-30,Prediksi $ISAT Tunggu konfirmasi break area resistance BUY 3700 TAKE PROFIT 4128 STOP LOSS 3600 CHART PATTERN BULLISH REVERSAL DOULE BOTTOMS https://t.co/mXnEpjBs6M *DISCLAIMER ON https://t.co/TByKARsYe2,prediksi $isat tunggu konfirmasi break area resistance buy 3700 take profit 4128 stop loss 3600 chart pattern bullish reversal doule bottoms https://t.co/mxnepjbs6m *disclaimer on https://t.co/tbykarsye2,prediksi isat tunggu konfirmasi break area resistance buy 3700 take profit 4128 stop loss 3600 chart pattern bullish reversal doule bottoms disclaimer on,prediksi isat tunggu konfirmasi break area resistance buy 3700 take profit 4128 stop loss 3600 chart pattern bullish reversal doule bottoms disclaimer on,prediksi isat tunggu konfirmasi break area resistance buy 3700 take profit 4128 stop loss 3600 chart pattern bullish reversal doule bottoms disclaimer on,prediksi isat tunggu konfirmasi break area resistance buy 3700 take profit 4128 stop loss 3600 chart pattern bullish reversal doule bottoms disclaimer on,"['prediksi', 'isat', 'tunggu', 'konfirmasi', 'break', 'area', 'resistance', 'buy', '3700', 'take', 'profit', '4128', 'stop', 'loss', '3600', 'chart', 'pattern', 'bullish', 'reversal', 'doule', 'bottoms', 'disclaimer', 'on']","['predictions', 'isat', 'wait', 'confirm', 'break', 'area', 'resistance', 'buy', '3700', 'take', 'profit', '4128', 'stop', 'loss', '3600', 'chart', 'Pattern', 'Bullish', 'Reversal', 'Doule', 'Bottoms', 'Bottoms' 'Disclaimer', 'On']",0.3612,2
2020-02-20,#EXCL #TLKM #ISAT $EXCL $TLKM $ISAT #IHSG $IHSG #JKSE $JKSE,#excl #tlkm #isat $excl $tlkm $isat #ihsg $ihsg #jkse $jkse,excl tlkm isat excl tlkm isat ihsg ihsg jkse jkse,excl tlkm isat excl tlkm isat ihsg ihsg jkse jkse,excl tlkm isat excl tlkm isat ihsg ihsg jkse jkse,excl tlkm isat excl tlkm isat ihsg ihsg jkse jkse,"['excl', 'tlkm', 'isat', 'excl', 'tlkm', 'isat', 'ihsg', 'ihsg', 'jkse', 'jkse']","['excl', 'tlkm', 'isat', 'excl', 'tlkm', 'isat', 'ihsg', 'ihsg', 'jkse', 'jkse']",0.0,0
2020-03-05,@kondorz_man terima kasih... ini lagi niup2 biar $ISAT tembus 2300 lagi..,@kondorz_man terima kasih... ini lagi niup2 biar $isat tembus 2300 lagi..,kondorz_man terima kasih ini lagi niup2 biar isat tembus 2300 lagi,kondorz_man terima kasih ini lagi tiup biar isat tembus 2300 lagi,kondorz_man terima kasih tiup biar isat tembus 2300 lagi,kondorz man terima kasih tiup biar isat tembus 2300 lagi,"['kondorz', 'man', 'terima', 'kasih', 'tiup', 'biar', 'isat', 'tembus', '2300', 'lagi']","['Kondorz', 'Man', 'accept', 'love', 'blow', 'let', 'isat', 'translucent', '2300', 'again']",0.7579,2
2020-03-05,di PHP sama $ISAT iihh bang**t... https://t.co/dkXRm5lHQI,di php sama $isat iihh bang**t... https://t.co/dkxrm5lhqi,di php sama isat iihh bangt,di php sama isat iihh bangt,php sama isat iihh banget,php sama isat iihh bangt,"['php', 'sama', 'isat', 'iihh', 'bangt']","['Php', 'Same', 'Isat', 'Iihh', 'Bangt']",0.0,0
2020-03-05,hari ini nyangkut di $ACES &amp; $ISAT peeewwdddiiiihhhh,hari ini nyangkut di $aces &amp; $isat peeewwdddiiiihhhh,hari ini nyangkut di aces amp isat peeewwdddiiiihhhh,hari ini nyangkut di aces amp isat pedih,hari nyangkut aces amp isat pedih,hari nyangkut aces amp isat pedih,"['hari', 'nyangkut', 'aces', 'amp', 'isat', 'pedih']","[aday', 'arcave', 'aces', 'sat', 'sat', 'peed'",0.0,0
2020-03-05,semoga $ISAT bisa segera melesat https://t.co/ denganHnTrqBj5,semoga $isat bisa segera melesat https://t.co/ denganhntrqbj5,semoga isat bisa segera melesat,semoga isat bisa segera naik cepat,semoga isat segera naik cepat,moga isat segera naik cepat,"['moga', 'isat', 'segera', 'naik', 'cepat']","['Moga', 'Isat', 'Immediately', 'Ride', 'Fast']",0.1531,2
2020-04-08,Ini bisa jadi salah satu bukti perusahaan yang memperlakukan karyawannya dengan baik memiliki nilai yang baik juga di mata investor. Tapi kira pemerintah perlu banget buat buyback sahamnya $ISAT gak sih?,ini bisa jadi salah satu bukti perusahaan yang memperlakukan karyawannya dengan baik memiliki nilai yang baik juga di mata investor. tapi kira pemerintah perlu banget buat buyback sahamnya $isat gak sih?,ini bisa jadi salah satu bukti perusahaan yang memperlakukan karyawannya dengan baik memiliki nilai yang baik juga di mata investor tapi kira pemerintah perlu banget buat buyback sahamnya isat gak sih,ini bisa jadi salah satu bukti perusahaan yang memperlakukan karyawannya dengan baik memiliki nilai yang baik juga di mata investor tapi kira pemerintah perlu banget buat beli kembali sahamnya isat tidak sih,bisa jadi salah satu bukti perusahaan memperlakukan karyawannya baik memiliki nilai baik di mata investor kira pemerintah perlu banget buat beli sahamnya isat sih,bisa jadi salah satu bukti usaha laku karyawannya baik milik nilai baik di mata investor kira perintah perlu banget buat beli saham isat sih,"['bisa', 'jadi', 'salah', 'satu', 'bukti', 'usaha', 'laku', 'karyawannya', 'baik', 'milik', 'nilai', 'baik', 'di', 'mata', 'investor', 'kira', 'perintah', 'perlu', 'banget', 'buat', 'beli', 'saham', 'isat', 'sih']","['can', 'become', 'wrong', 'one', 'proof', 'business',' behavior ',' employees', 'good', 'property', 'value', 'good', 'in', 'eyes',' investors', 'think', 'command', 'really', 'really', 'make', 'buy', 'shares',' 'any'], ''",0.8179,2
2020-04-23,Tgl 8 ajuin penutupan postpaid Tgl 21 hub cs mnt detail tagihan terakhir cs mnt data nama tgl lahir almt &amp; tagihan terakhir(sudah diberikan) Tgl 23 baru direspon data yang dikasih  dengann mnt ulang lg data yang sama + 1jam kemudian mnt foto KTP &amp; surat pengajuan @IndosatCare $ISAT ,tgl 8 ajuin penutupan postpaid tgl 21 hub cs mnt detail tagihan terakhir cs mnt data nama tgl lahir almt &amp; tagihan terakhir(sudah diberikan) tgl 23 baru direspon data yang dikasih  dengann mnt ulang lg data yang sama + 1jam kemudian mnt foto ktp &amp; surat pengajuan @indosatcare $isat ,tgl 8 ajuin penutupan postpaid tgl 21 hub cs mnt detail tagihan terakhir cs mnt data nama tgl lahir almt amp tagihan terakhirsudah diberikan tgl 23 baru direspon data yang dikasih  dengann mnt ulang lg data yang sama 1jam kemudian mnt foto ktp amp surat pengajuan indosatcare isat,tgl 8 ajuin penutupan postpaid tgl 21 hub cs mnt detail tagihan terakhir cs mnt data nama tgl lahir almt amp tagihan terakhirsudah diberikan tgl 23 baru direspon data yang dikasih dengan mnt ulang lagi data yang sama 1jam kemudian mnt foto ktp amp surat pengajuan indosatcare isat,tgl 8 ajuin penutupan postpaid tgl 21 hub cs mnt detail tagihan terakhir cs mnt data nama tgl lahir almt amp tagihan terakhirsudah diberikan tgl 23 baru direspon data dikasih mnt ulang lagi data sama 1jam kemudian mnt foto ktp amp surat pengajuan indosatcare isat,tgl 8 ajuin tutup postpaid tgl 21 hub cs mnt detail tagih akhir cs mnt data nama tgl lahir almt amp tagih terakhirsudah beri tgl 23 baru direspon data kasih mnt ulang lagi data sama 1jam kemudian mnt foto ktp amp surat aju indosatcare isat,"['tgl', '8', 'ajuin', 'tutup', 'postpaid', 'tgl', '21', 'hub', 'cs', 'mnt', 'detail', 'tagih', 'akhir', 'cs', 'mnt', 'data', 'nama', 'tgl', 'lahir', 'almt', 'amp', 'tagih', 'terakhirsudah', 'beri', 'tgl', '23', 'baru', 'direspon', 'data', 'kasih', 'mnt', 'ulang', 'lagi', 'data', 'sama', '1jam', 'kemudian', 'mnt', 'foto', 'ktp', 'amp', 'surat', 'aju', 'indosatcare', 'isat']","['tgl', '8', 'ajuin', 'tutup', 'postpaid', 'tgl', '21', 'hub', 'cs', 'mnt', 'detail', 'tagih', 'akhir', 'cs', 'mnt', 'data', 'nama', 'tgl', 'lahir', 'almt', 'amp', 'tagih', 'Last one,', 'Give', 'Date', '23', 'New', 'Reported', 'Data', 'Love', 'Mnt', 'Repeat', 'Again', 'Data', 'Same', '1 Hours', 'Then', 'Mnt', 'Photos', 'KTP', 'KTP', 'Amp', 'Letter', 'Letter', 'Indosatcare', 'Isat', 'Isat', 'Isat', 'Isat', 'Isat'",0.6369,2
2020-04-23,Nomor udah proses tutup ke gerai di 8 april 2020 cuma masih harus nunggu tagihan terakhirny keluar ditgl 20 dan pembayaran katany cuma bisa di gerai indosat. Nanya ke CS twitter malah dikerjain lewat email direspon BOT doang.. Mantap @IndosatCare $ISAT,nomor udah proses tutup ke gerai di 8 april 2020 cuma masih harus nunggu tagihan terakhirny keluar ditgl 20 dan pembayaran katany cuma bisa di gerai indosat. nanya ke cs twitter malah dikerjain lewat email direspon bot doang.. mantap @indosatcare $isat,nomor udah proses tutup ke gerai di 8 april 2020 cuma masih harus nunggu tagihan terakhirny keluar ditgl 20 dan pembayaran katany cuma bisa di gerai indosat nanya ke cs twitter malah dikerjain lewat email direspon bot doang mantap indosatcare isat,nomor udah proses tutup ke gerai di 8 april 2020 hanya masih harus nunggu tagihan terakhirny keluar ditgl 20 dan pembayaran katany hanya bisa di gerai indosat nanya ke cs twitter malah dikerjain lewat email direspon bot doang mantap indosatcare isat,nomor udah proses tutup gerai 8 april 2020 masih nunggu tagihan terakhirny keluar ditgl 20 pembayaran katany bisa gerai indosat nanya cs twitter malah dikerjain lewat email direspon bot doang mantap indosatcare isat,nomor udah proses tutup gerai 8 april 2020 masih nunggu tagih terakhirny keluar ditgl 20 bayar katany bisa gerai indosat nanya cs twitter malah dikerjain lewat email direspon bot doang mantap indosatcare isat,"['nomor', 'udah', 'proses', 'tutup', 'gerai', '8', 'april', '2020', 'masih', 'nunggu', 'tagih', 'terakhirny', 'keluar', 'ditgl', '20', 'bayar', 'katany', 'bisa', 'gerai', 'indosat', 'nanya', 'cs', 'twitter', 'malah', 'dikerjain', 'lewat', 'email', 'direspon', 'bot', 'doang', 'mantap', 'indosatcare', 'isat']","['number', 'already', 'process', 'closed', 'outlets', '8', 'April', '2020', 'still', 'waiting', 'collect', 'Lastly', 'out', 'Ditgl', '20', 'Pay', 'Katany', 'Katany', 'can', 'outlets', 'indosat', 'ask', 'cs', 'twitter' 'Working on', 'Through', 'Email', 'responded', 'bot', 'doang', 'great', 'Indosatcare', 'Isat']",0.2263,2
2020-05-27,Lu gak ikut IPO $ISAT @maspieDoank ,lu gak ikut ipo $isat @maspiedoank ,lu gak ikut ipo isat maspiedoank,kamu tidak ikut ipo isat maspiedoank,kamu ikut ipo isat maspiedoank,kamu ikut ipo isat maspiedoank,"['kamu', 'ikut', 'ipo', 'isat', 'maspiedoank']","['You', 'join', 'IPO', 'Isat', 'Maspiedoank']",0.296,2
2020-06-01,@adriankusaihir1 @DarwisSteven @FaldoMaldini Beli aset perushaan bukan hanya sekedar memiliki perushaan tpi harus menguntungkan. $ISAT terakhir bagi dividen 2008 2009 ampe skrng masih zonk. skrng msih ngandalin duit investor ooredeo. https://t.co/OcCX3PZXL0,@adriankusaihir1 @darwissteven @faldomaldini beli aset perushaan bukan hanya sekedar memiliki perushaan tpi harus menguntungkan. $isat terakhir bagi dividen 2008 2009 ampe skrng masih zonk. skrng msih ngandalin duit investor ooredeo. https://t.co/occx3pzxl0,adriankusaihir1 darwissteven faldomaldini beli aset perushaan bukan hanya sekedar memiliki perushaan tpi harus menguntungkan isat terakhir bagi dividen 2008 2009 ampe skrng masih zonk skrng msih ngandalin duit investor ooredeo,adriankusaihir1 darwissteven faldomaldini beli aset perushaan bukan hanya sekedar memiliki perushaan tapi harus menguntungkan isat terakhir bagi dividen 2008 2009 sampai sekarang masih zonk sekarang msih ngandalin uang investor ooredeo,adriankusaihir1 darwissteven faldomaldini beli aset perushaan bukan sekedar memiliki perushaan harus menguntungkan isat terakhir dividen 2008 2009 sekarang zonk sekarang msih ngandalin uang investor ooredeo,adriankusaihir1 darwissteven faldomaldini beli aset perushaan bukan dar milik perushaan harus untung isat akhir dividen 2008 2009 sekarang zonk sekarang msih ngandalin uang investor ooredeo,"['adriankusaihir1', 'darwissteven', 'faldomaldini', 'beli', 'aset', 'perushaan', 'bukan', 'dar', 'milik', 'perushaan', 'harus', 'untung', 'isat', 'akhir', 'dividen', '2008', '2009', 'sekarang', 'zonk', 'sekarang', 'msih', 'ngandalin', 'uang', 'investor', 'ooredeo']","['Adriankusaihir1', 'Darwissteven', 'Faldomaldini', 'Buy', 'Assets', 'Assets', 'Research', 'Not', 'Dar', 'Owned', 'Owned', 'Must', 'Must', 'Untah', 'Isat', 'End', 'Dividend', '2008' 'Ngandalin', 'Money', 'Investor', 'Ooredeo']",0.7269,2
2020-06-04,siang belanja lagi tadi udah rugi dikit 1.5% $indy hahaha begini nih kalau bau2 mau turun beli apapun gambar udah bagus pada gagal cuma dapat $ISAT 2100 warning perusahaan rugi jangan harap bisa jauh2 naiknya trade not invest https://t.co/26Mdr4LiEB,siang belanja lagi tadi udah rugi dikit 1.5% $indy hahaha begini nih kalau bau2 mau turun beli apapun gambar udah bagus pada gagal cuma dapat $isat 2100 warning perusahaan rugi jangan harap bisa jauh2 naiknya trade not invest https://t.co/26mdr4lieb,siang belanja lagi tadi udah rugi dikit 15 indy hahaha begini nih kalau bau2 mau turun beli apapun gambar udah bagus pada gagal cuma dapat isat 2100 warning perusahaan rugi jangan harap bisa jauh2 naiknya trade not invest,siang belanja lagi tadi udah rugi dikit 15 indy hahaha begini nih kalau bau2 mau turun beli apapun gambar udah bagus pada gagal hanya dapat isat 2100 warning perusahaan rugi jangan harap bisa jauh2 naiknya trade not invest,siang belanja tadi udah rugi dikit 15 indy hahaha begini nih kalau bau2 mau turun beli apapun gambar udah bagus gagal dapat isat 2100 warning perusahaan rugi jangan harap jauh2 naiknya trade not invest,siang belanja tadi udah rugi dikit 15 indy hahaha begini nih kalau bau2 mau turun beli apa gambar udah bagus gagal dapat isat 2100 warning usaha rugi jangan harap jauh2 naik trade not invest,"['siang', 'belanja', 'tadi', 'udah', 'rugi', 'dikit', '15', 'indy', 'hahaha', 'begini', 'nih', 'kalau', 'bau2', 'mau', 'turun', 'beli', 'apa', 'gambar', 'udah', 'bagus', 'gagal', 'dapat', 'isat', '2100', 'warning', 'usaha', 'rugi', 'jangan', 'harap', 'jauh2', 'naik', 'trade', 'not', 'invest']","['afternoon', 'shopping', 'earlier', 'already', 'loss',' little ',' 15 ',' indy ',' hahaha ',' like ',' here ',' if ',' smell2 ',' want ',' down ',' buy ',' what ',' picture ',' picture ',' already ',' good ',' failed ',' 'Loss', 'Don't', 'Hope', 'far', 'Rise', 'Trade', 'Not', 'Invest']",-0.598,1
